{
  "schemaVersion": 1,
  "title": "The Modern AI Stack: Demystifying the Architecture of Artificial Intelligence",
  "slug": "modern-ai-stack",
  "thesis": "Artificial intelligence is not a single monolithic product but a modular stack of distinct engineering layers; understanding the layers helps builders and observers place tools, companies, and research advances in context.",
  "audience": [
    "builders",
    "students",
    "general"
  ],
  "primary_reader": "A technically-curious reader who encounters AI tools like ChatGPT, Claude Desktop, or open-source models and wants a map of how the pieces fit together.",
  "intended_outcome": "Readers should be able to place a tool or research announcement into the correct layer of the AI stack and understand why much of the industry's engineering focus has shifted toward orchestration and tool protocols.",
  "artifact_fit": "An article fits because the value is a durable conceptual model and shared vocabulary, not a one-off product announcement or code snippet.",
  "smallest_viable_version": "The nine-layer model plus the mapping table, with each layer summarized in one paragraph and tied to a public example.",
  "scope_risks": "The article could become an exhaustive product catalog or a stale benchmark comparison. It should stay at the conceptual layer, label the model as the author's proposed taxonomy, and let the mapping table carry the examples.",
  "alternatives_considered": "A single diagram or a glossary; the layered narrative was chosen because it gives readers a decision framework, not just definitions.",
  "tags": [
    "ai-stack",
    "agent-architecture",
    "mcp",
    "rag",
    "inference",
    "model-alignment",
    "tooling"
  ],
  "maturity": "sprout",
  "claims": [
    "Modern AI systems can be usefully understood as a modular stack rather than a single monolithic model.",
    "Base-model scaling remains important, but much of the visible product engineering and investment has moved up the stack toward orchestration and tool protocols.",
    "Retrieval-augmented generation is a common pattern for grounding models in proprietary or real-time data.",
    "Model Context Protocol (MCP) is emerging as a common adapter for agent-tool integration.",
    "End-user applications such as Claude Desktop bundle multiple lower layers into a single GUI."
  ],
  "sources": [
    {
      "title": "Nous Research Hermes Agent on GitHub",
      "url": "https://github.com/nousresearch/hermes-agent",
      "type": "product",
      "accessed": "2026-07-06"
    },
    {
      "title": "OpenRouter",
      "url": "https://openrouter.ai/",
      "type": "product",
      "accessed": "2026-07-06"
    },
    {
      "title": "Model Context Protocol \u2014 Anthropic",
      "url": "https://www.anthropic.com/news/model-context-protocol",
      "type": "product",
      "accessed": "2026-07-06"
    },
    {
      "title": "Meta Llama 3",
      "url": "https://ai.meta.com/blog/meta-llama-3/",
      "type": "product",
      "accessed": "2026-07-06"
    },
    {
      "title": "vLLM documentation",
      "url": "https://docs.vllm.ai/",
      "type": "product",
      "accessed": "2026-07-06"
    },
    {
      "title": "LangGraph",
      "url": "https://langchain-ai.github.io/langgraph/",
      "type": "product",
      "accessed": "2026-07-06"
    },
    {
      "title": "CrewAI",
      "url": "https://crewai.com/",
      "type": "product",
      "accessed": "2026-07-06"
    },
    {
      "title": "Claude desktop app",
      "url": "https://claude.ai/download",
      "type": "product",
      "accessed": "2026-07-06"
    }
  ],
  "related_articles": [
    "article:agent-control-planes",
    "article:ai-delegation-orchestration"
  ],
  "sanitized_summary": "A conceptual tour of the modern AI stack organized into nine layers, from compute\nhardware and base models through alignment, inference, retrieval, orchestration,\ntool protocols, guardrails, and end-user applications. The article uses public\nproducts and protocols as anchor examples and argues that much of the industry's\nengineering focus has shifted up the stack toward agentic orchestration and tooling.\n",
  "abstraction_examples": [
    {
      "original": "The user pasted a draft generated by an AI assistant.",
      "abstracted": "The draft was produced with AI assistance and is being proposed as a public knowledge-garden article."
    }
  ],
  "privacy_acknowledgment": true,
  "agent_involvement": "Original draft text was generated by an AI assistant; revisions, proposal, and review were prepared with agent assistance and await human approval.",
  "draft_available": true
}
